index,text,label,beta_shapley,loo
515,"Giving Up Something, Or Not Giving Up Something, for Lent I am not suggesting that we just suppose that everyone around us can be trusted and we need not worry about our personal safety or the security of personal belongings. But I do propose giving up the practice of focusing on the faults of other people and, instead, looking for their good qualities. William B. Bradshaw, ContributorAuthor",RELIGION,0.00015553842442553287,0.0001121414586087166
724,"Bubble 'Life Cycle' Described With Help Of Climate Modeling Technique by Lizzie Wade on 9 May 2013, 2:00 PM Another day, another groundbreaking physics experiment about bubbles. Although scientists Melissa Cronin",SCIENCE,0.00015422527816885773,0.00013190526473350062
883,Paul Ryan Says There Will Be No Immigration Reform Under Obama The newly elected speaker says the president can't be trusted. Sam Stein,POLITICS,0.00015288060279900918,0.0001715022259216603
23,"Donald Trump’s Immigration Plan: Big Promises, Bigger Doubts Big promises are to be expected from presidential candidates, but reality often intrudes. ",POLITICS,0.0001526656437294773,0.00012986881513876725
689,Obama To Give Statement From The Oval Office He's speaking after meeting with his national security team. Paige Lavender,POLITICS,0.00015143592294504673,0.00012753002049925577
280,"'Single Gene May Hold Key to Life Itself' Distortions and sensationalism really only explain how deterministic stories persist -- not why. There must be something satisfying and lucrative about ""gene-for"" stories. What is so sexy about a gene for IQ? Nathaniel Comfort, Contributor
Associate professor, Department of the History of Medicine, Jo...",SCIENCE,0.00015133319122814345,8.688708334458894e-05
244,"Changing a Church The opportunity now exists for the Episcopal Church to set a different example for how the future might unfold -- not just for itself, but for all the mainline churches. The way of doing that is not to focus on the top, but rather on the bottom, of the structure. Mark D. W. Edington, ContributorA writer, publisher, social entrepreneur, and pastor.",RELIGION,0.00014935102496261746,0.00016134687534008485
400,"Higgs Boson Nobel Prize? Scientists Ponder Whether Prize Should Go To One Physicist Or Many The true difficulty with awarding Nobels now is that as the body of scientific knowledge grows, it's getting harder to find ",SCIENCE,0.00014896388986998258,0.00015442303321999695
181,Jerusalem Churches Take On Hate Graffiti  ,RELIGION,0.0001447197523738659,0.00012095393243027885
79,"Senator Tammy Baldwin: A Fighter For The People These days, the little guy is always left with the short end of the stick. Nowhere is that more evident than in Congress Tiffany Muller, ContributorPresident, End Citizens United",POLITICS,0.0001441827360444211,0.00013661208623294563
169,"Prayer for Muslim-Jewish Relations We are two American religious communities in such pain from the outburst of extremist violence in France that we not only have forgotten each other. We have forgotten ourselves. Rabbi Joshua Stanton, ContributorRabbi, Millennial, Interfaith Leader",RELIGION,0.00014385274436741973,0.00023036685873467633
192,"Martin Scorsese Brings 'Silence' To The Big Screen: A Story of Faith And Betrayal In 17th-century Japan The wait is over. The long anticipated film adaptation of Japanese author, Endō Shūsaku’s novel Silence by director, Martin M. Antoni J. Ucerler, S.J., ContributorDirector, Ricci Institute for Chinese-Western Cultural History...",RELIGION,0.00014372076150717442,0.00015211793707292642
308,"So That Happened: With Iran Letter, GOP Senators Basically Say 'Don't Trust America'  Jason Linkins, Arthur Delaney, Zach Carter, and Jessica Schulberg",POLITICS,0.00014306017368828443,0.00018759305575355434
319,"Daily Meditation: Finding The Sacred We all need help maintaining our personal spiritual practice. We hope that these Daily Meditations, prayers and mindful awareness Antonia Blumberg",RELIGION,0.00014270715838092985,0.00018894287554349631
725,"Pope To Prisoners: I Am A Man 'Who Was Saved From His Many Sins' SANTA CRUZ, Bolivia (AP) - Pope Francis urged inmates at Bolivia's notoriously violent Palmasola prison to not despair on Nicole Winfield, Associated Press",RELIGION,0.00014256589656911738,0.00018740569824604592
885,"What If Obama Really Went Off the Deep End Like Honduras' Mel Zelaya Just imagine this story. President Barack Obama decides he wants to have a national referendum on being able to have a national referendum during the next general elections. Marco Cáceres, ContributorEditor, Honduras Weekly",POLITICS,0.00014192708224838277,0.00014740479272101759
786,"Alabama Governor: If We Can Put A Man On The Moon, We Can Build More Prisons The Department of Justice launched an investigation last year into conditions at the state's prisons. Sam Levine",POLITICS,0.0001402532886347281,0.0002235186359484942
910,"The Constitutional Apocalypse If you don't believe state legislatures matter, consider this. Les Leopold, ContributorExecutive Director, The Labor Institute",POLITICS,0.00013984320522086218,0.00012498557270168575
800,"Old Man On Golf Course Complains About Other People Not Working Truly, Donald Trump is a Republican now. Eliot Nelson and Jeffrey Young",POLITICS,0.00013942952418590196,0.00016542221110515953
201,"Daily Meditation: Sabbath We all need help maintaining our personal spiritual practice. We hope that these Daily Meditations, prayers and mindful awareness Antonia Blumberg",RELIGION,0.00013941836059211868,0.00018894287554349631
960,DISCOVERED: Ancient Forest Fire Locked In Stone  ,SCIENCE,0.0001387673754933245,0.00012010992121247455
970,"Rabbi Jonathan Sacks On What It Takes To End Violence In God's Name His new book is a call to all the faiths to make space for the religious “other.” Lauren Markoe, Religion News Service",RELIGION,0.0001385886271291351,0.00016094374518127452
304,"Scientists Can Detect Your Sleeptime Memories Even If You Can’t Trying to learn Spanish while you nap, eh? Bahar Gholipour",SCIENCE,0.00013705032626608118,0.00015316864278958064
836,"Joe Scarborough: Trump's Legal Strategy Is Like 'A Monkey Throwing Poo Against The Wall' ""It doesn't usually turn out well,"" the MSNBC host said of feces flinging. Hayley Miller",POLITICS,0.000136710668282035,9.658366932363549e-05
704,'White Noise' For Your Nose Cancels Out Nasty Odors  Jacqueline Howard,SCIENCE,0.00013669200839973333,0.00010727807737387351
118,Elizabeth Warren Calls Out Senate Republicans' Hypocrisy On Trump Republicans are criticizing Donald Trump while keeping a Supreme Court seat open in hopes he'll become president. Mollie Reilly,POLITICS,0.000136294854046707,0.00027033381102081755
606,11 Tweets That Sum Up The Absurdity of The Burkini Ban The full body swimsuit worn by  some Muslim women has been outlawed in three French cities. Antonia Blumberg,RELIGION,0.00013381512762023558,0.0001474558142764426
938,"The Hunting Ground: Stop Victim Blaming and End Campus Rape I believe the two most basic religious questions are: ""What can I trust?"" and ""Am I alone?""  The immoral failure of schools of higher learning to be a place students can trust is, in the broadest sense, a betrayal of this religious value. Rev. Dr. Susan Brooks Thistlethwaite, ContributorProfessor of Theology, Chicago Theological Seminary",RELIGION,0.00013326162509183325,0.00010224397941827057
962,Trump Willing To Testify Under Oath About Russia And Comey The former FBI director called Trump a liar. Elise Foley and Arthur Delaney,POLITICS,0.00013272738928750438,0.00015667009309305868
427,"Be Bold in Our Support for Women and Families Be Bold. I cannot think of a better call to action for people of faith who care about reproductive health, rights and justice. Rev. Darcy Baxter, ContributorMinister, repro-&-family-justice activist, thea/ologian. Bridg...",RELIGION,0.00013214267887114986,0.00013490653008818576
466,"SAY IT: People Beg Trump To Clearly Denounce White Supremacy By Sunday, White House officials clarified that he meant to do so, yet there was still no denouncement from Trump himself. Carla Herreria and Marina Fang",POLITICS,0.00013154885425577503,0.00015678516921391328
431,"Will Tax Reform Close The Gaps? As Congress takes up tax code reform, there is one thing we can be sure of. Most of us will not understand what the House William S. Becker, ContributorEnergy & Climate Policy Expert",POLITICS,0.00013109173977555303,0.00012370275440209966
829,"NASA Launches GOES-R Weather Satellite Images from the satellite are expected to enhance weather forecasts, provide advanced warning of floods and better tracking of wildfires, plumes and volcanic ash clouds. Irene Klotz, Reuters",SCIENCE,0.00012944201845548037,0.00013731013296447436
954,"Reflections on Justice After Ferguson, MO:  When Will Youth of Color Receive the Same Due Process as Officer Darren Wilson? It turns out that justice, like so much of what happens in America, has two faces. Michael Brown's shooting -- and the image of his young black body left lying for hours in the summer sun -- has become a symbol of the many forms of unfairness suffered by youth of color across America. Marsha Levick and Mae C. Quinn, Contributors",POLITICS,0.000129324591208177,9.442521452185382e-05
83,A Poll Finds Most Americans Don’t Trust Public Opinion Polls But there's literally no other way to measure what the public thinks. Natalie Jackson and Grace Sparks,POLITICS,0.00012746587917120676,8.204738184036664e-05
134,The Ideologies Of American Churches In One Graph  Antonia Blumberg,RELIGION,0.00012566963193841674,0.00019240207924031694
367,The Science Behind How Cute 'Tuxedo' Cats Get Their Patchy Fur How piebald patches form on animal fur might help us better understand genetic diseases in humans. Jacqueline Howard,SCIENCE,0.00012453812408698005,0.00015123600058952746
161,Missing Comet Lander 'Philae' Finally Located After Long Search The hunt is over! David Freeman,SCIENCE,0.00012409085560699128,9.654505231782018e-05
869,Retired Research Chimps Are Really Enjoying Their New Home  Dominique Mosbergen,SCIENCE,0.0001240342496253987,7.525434300914569e-05
318,"Trump And The Catholic Schism No religion can survive long, or fruitfully, in fundamental conflict with the culture of its time. Rosemary Westwood, ContributorColumnist and Writer",RELIGION,0.0001236350233776801,0.00012013133472477122
941,"Polar Bears Trap Team Of Scientists Inside Remote Weather Station In Russia “The bears live in the Arctic, you know ― we can’t ban them from hanging around."" Ed Mazza",SCIENCE,0.00012265465730902262,0.00014478732337819267
139,Obama To Visit A Mosque For The First Time As President The visit comes after he called for Muslim Americans to help fight extremism. Sam Levine,POLITICS,0.00012232158163378836,0.00015857002185759583
898,"Jeb Bush Calls For Crackdown On Sanctuary Cities In Immigration Plan Bush's proposals are heavy on enforcement, light on detail about undocumented immigrants. Elise Foley",POLITICS,0.00012196871611997599,0.00011309590234698241
211,"The Rabbi and the Christmas Tree Just before Christmas the previous year, my mother (""Mimi"" to her grandchildren) had died in my childhood home in Savannah, Georgia.  For the first time in my life I had decided to spend Christmas away from my family of origin, away from Savannah.  It was not an uncomplicated decision, but I had made peace with it. Rev. Eleanor Harrison Bregman, ContributorDirector of Multi-Faith Initiatives at Romemu",RELIGION,0.00012194446019593264,0.00016921641649414454
809,Does This Headline Look Blue To You? Then It Might Also Feel Like A Triangle. Research shows that synesthesia may extend in more directions than we thought. Bahar Gholipour,SCIENCE,0.00012122851226437046,0.00011815976909690384
834,"Michelle Obama To Release 'Deeply Personal' Memoir In November ""I talk about my roots and how a girl from the South Side found her voice,"" the former first lady tweeted. Hayley Miller",POLITICS,0.0001207624455537286,0.0001303861970340936
31,"Buddhist in America Growing up in a Buddhist family in Virginia in the '80s, I was often on the defensive about my family's beliefs. It was not unusual to be shunned by other kids because I did not believe in God the same way they'd been taught in church. Nathan Gauer, ContributorAuthor of Songs to Make the Desert Bear Fruit",RELIGION,0.00012071203315768355,0.0001080076243082928
243,"Ramadan Reflection Day #6: Bringing Life Back Into Our Work/Life Balance Even though I don't probably do what most people do for a living, I was making the same mistakes that many people make in regards to how they prioritize their careers over themselves. Imam Khalid Latif, ContributorExecutive Director and Chaplain, Islamic Center at New York Un...",RELIGION,0.00011997902537712981,0.00011158551013834561
755,"Bishops Debate Where Doctrine Ends, Pastoral Practice Begins  ",RELIGION,0.00011882546826976596,0.00013949257748802069
872,"Prostate Adventures: Another Reason to Appreciate the California Stem Cell Program Cancer is tough to kill. It may go into remission and come back later. Fortunately, the California stem cell program is pretty tough too. Don C. Reed, Contributor
Sponsor, California’s Roman Reed Spinal Cord Injury Research A...",SCIENCE,0.0001181745853516826,0.00013318171785137167
751,"U.S. Lawmakers Want To Bar States From Making Your Phone Less Secure The ENCRYPT Act is sponsored by Democratic Representative Ted Lieu and Republican Blake Farenthold. Dustin Volz, Reuters",POLITICS,0.00011759659820774327,0.00011452674885625846
513,Can Religion And Politics Mix For Good Rather Than Evil?  ,RELIGION,0.0001172070704680161,0.00016660883908015123
98,15 Photos From Astronaut's Year In Space That Are Out Of This World Scott Kelly's Twitter feed gave us an incredible view of Earth. Jacqueline Howard,SCIENCE,0.00011661017888330052,0.0003150167605865395
20,"Do You Know Where Your E. coli Are? Clearly the contamination of recreational waters and key venues is a big concern.  But when you go, do you know that you could leave your E. coli behind?  And what does that mean in regard to your health? Joan Rose, Contributor
I am a water microbiologist that works at the interface betwee...",SCIENCE,0.00011639122141744362,9.669621757923963e-05
561,"RNC Chair: Trump Was Just Making Small Talk When He Asked FBI Head How He Voted ""This is a president who is just getting to know people, and that’s part of those conversations,” said Ronna Romney McDaniel. Marina Fang",POLITICS,0.00011600145832890666,0.00010284071177868448
255,"Man Between God and the Devil: Martin Luther and the Reclamation of Halloween What if I looked at on this Reformation Day Oberman's critique in light of Halloween how would Luther speak today in that reclamation? What would a reclaimed Halloween express? Reverend William E. Flippin, Jr., ContributorChurch Planting/Grassroots Strategist/Ecumenist",RELIGION,0.00011484697131735907,8.936618813915054e-05
254,"John Boehner Calls Ted Cruz 'Lucifer,' Word Searches Dramatically Spike Apparently some people had to look up the devil's lesser-known name. Antonia Blumberg",RELIGION,0.00011455112340356332,8.687262279094554e-05
881,"Alien Life? Study Suggests Vast Number Of Planets Could Harbor It ""The habitable zone would be very, very small. Consequently, the chances that you would actually find any planet at the right ",SCIENCE,0.00011379231748676902,0.00016620583257664912
346,"Progressive Christians To Pray In Solidarity With Muslims At Mosques On Inauguration Day First they came for the Socialists, and I did not speak out. Jim Burklo, ContributorAssociate Dean of Religious Life, University of Southern Calif...",RELIGION,0.00011360678008739443,0.00015637279379498992
808,"Daily Meditation: Sun-Kissed We all need help maintaining our personal spiritual practice. We hope that these Daily Meditations, prayers and mindful awareness Antonia Blumberg",RELIGION,0.00011350837172354664,0.00018127252523125748
701,California Moves To Crack Down On Super PAC Coordination A state regulator steps up while federal action remains out of reach. Paul Blumenthal,POLITICS,0.00011221255801909231,0.00010328088606947894
585,"Remains Of Prehistoric Monument Discovered Near Stonehenge ""Everything written previously about the Stonehenge landscape and the ancient monuments within it will need to be re-written."" Lydia O'Connor",SCIENCE,0.00011169951892394665,0.00010845043333818083
168,A Frightening Proposal To Intern Muslim Americans Terrorist violence can make the previously unthinkable suddenly seem acceptable. The levels of surveillance introduced after ,RELIGION,0.00011159679845431106,0.0001690067957151875
736,"The Troubling Persistence Of The Hatred Of Black People The sound and the fury about the presence and the persistence of racism have been loud and boisterous from much of the public Susan K Smith, ContributorRev. Dr.",RELIGION,0.00011126505466342407,0.00013394345831074794
604,"The Supreme Court Gave Gay Marriage A Big Kanye Shrug  Jason Linkins, Arthur Delaney, and Eliot Nelson",POLITICS,0.00011092587736329855,0.00010019858729926057
222,"Fathers' Sexism May Curb Daughters' Work Ambitions, Research Suggests The researchers aren't sure why boys didn't respond in the same way as girls to their fathers' attitudes. It's possible that ",SCIENCE,0.00011052333734944471,0.0001064073983421121
110,Giant Ken Burns Fan Ron Johnson Once Tried To Defund PBS The GOP senator says students would learn more from Burns' documentaries than from teachers. Laura Barrón-López,POLITICS,0.00011031225122928661,0.00014183701179848462
592,Judge Challenging Alabama Chief Justice On Gay Marriage: 'We're On The Right Side Of History'  Ariel Edwards-Levy,POLITICS,0.00011016976621322977,0.00011700608927722733
887,"Former Republican Presidential Candidate Bob Dole Hospitalized He's been hospitalized since last week due to low blood pressure, his spokeswoman said. Gina Cherelus, Reuters",POLITICS,0.00010899805756336743,0.00015249345290269112
925,Were Scientists Wrong About Reefs?  Macrina Cooper-White,SCIENCE,0.00010896622214725805,0.00010364607233470657
498,"Study Reveals Stunning Acceleration Of Sea Level Rise The oceans have heaved up and down as world temperatures have waxed and waned, but as new research tracking the past 2,800 ",SCIENCE,0.00010886910420127396,0.00011126793167548499
539,"'Noah' and the Boring Fundamentalism of Hollywood Bible Movies Sometimes evangelical Christians make movies. And usually they are horrible. The themes are poorly executed. Instead of life imitated in inspiring ways through the medium of film, a sermon is smugly preached. Zach J. Hoag, ContributorAuthor, Preacher, Binge-Watcher",RELIGION,0.00010856197421218861,8.52036757705843e-05
305,"Plants 'Do Math' To Ensure Steady Food Supply, New Research Shows They can even compensate for an unexpected early night. ""This is the first concrete example in a fundamental biological process Reuters, Reuters",SCIENCE,0.00010701758462137729,8.152545341011397e-05
907,First Oil Could Flow Through The Dakota Access Pipeline Next Week A Native American tribe had argued that an oil-filled pipeline would violate their freedom of religion. Michael McLaughlin,POLITICS,0.00010542672607567664,6.997398674024602e-05
721,"Jupiter, Moon To Shine Closely Together In Night Sky Monday The table accompanying this guide gives local times of Jupiter's closest approach to the moon's upper edge on the night of ",SCIENCE,0.00010435179283649857,9.423703405642136e-05
133,Donald Trump's Proposed Muslim Ban Has Not Aged Well: A Timeline It's been a winding road. Antonia Blumberg,RELIGION,0.00010313981949588661,0.0001456074494177173
893,"Murders By U.S. White Supremacists More Than Doubled In 2017, New Report Shows And right-wing extremists killed more than twice as many people as Islamic extremists. Christopher Mathias",POLITICS,0.00010280733703679425,7.577683672121971e-05
580,Religious Tension High After Mosque Closures  ,RELIGION,0.0001024653946993564,8.720563226560785e-05
379,The Key To Understanding Pope Francis: All Together Podcast With Father James Martin Because he's free! Paul Brandeis Raushenbush,RELIGION,0.00010236056867101711,0.00020458319423521942
501,"Punishing Without Evidence: The Trump Administration’s Gratuitous Steps To Roll Back Progress Between The United States And Cuba Whoever is responsible for attacks on U.S. Embassy personnel has a clear agenda. We can't let them succeed. Sen. Patrick Leahy, ContributorU.S. Senator, Vermont",POLITICS,0.00010106226405803531,9.521054007377572e-05
766,Donald Trump Attempts To Appeal To Bernie Sanders Supporters In Convention Speech Good luck. Elise Foley,POLITICS,9.959658691127658e-05,0.0001592472774414322
615,"The Mistrust Of Science If this place has done its job—and I suspect it has—you’re all scientists now. Sorry, English and history graduates, even ",SCIENCE,9.917225433114603e-05,0.0001401119234252235
368,"Robert E. Lee's Descendant Leaves Church After Denouncing White Supremacy ""A faction of church members were concerned about my speech,"" he said. Jenna Amatulli",RELIGION,9.908604620276371e-05,0.00010821912697722702
266,"Trump's Economic Vision Could Blow A $1 Trillion Hole In U.S. Economy, Study Finds Things could really go downhill if the GOP nominee were able to implement his policies without restraint. Matt Ferner",POLITICS,9.868003006429693e-05,0.00010888605296921483
463,"Gay Marriage: A Christian Response Can a faithful Christian support the court's decision? What can we say in response to questions voiced by some Christian people? Barbara Kay Lundblad, ContributorOrdained minister, Evangelical Lutheran Church in America",RELIGION,9.866821395862344e-05,0.00015620736419985626
627,"New UK Super Prison A Model of Reform Over Punishment By Christopher Zoukis It's a slow shift, but the criminal justice system moving its focus more toward rehabilitation and Christopher Zoukis, ContributorAuthor and Prisoners' Rights Advocate",POLITICS,9.823115907723934e-05,7.078252639214355e-05
817,Why Death Is The Liveliest Topic At The Edinburgh Festival Fringe  Jaweed Kaleem,RELIGION,9.749228693809601e-05,0.00012602575230347135
980,"The Secret of Coolness Revealed We have brought back James Dean to our current days' cool. I could breathe freely again. Cancel my tattoos' removal appointment. Light another smoke. Ilan Dar-Nimrod, Contributor
Assistant Professor, University of Sydney",SCIENCE,9.740159330212059e-05,7.998432110412068e-05
512,"Why I Can No Longer Support My Former Employer, InterVarsity Christian Fellowship They have drawn the wrong line in the sand. Matthew D. Taylor, ContributorBorn fundamentalist, raised Evangelical, seminary trained, now...",RELIGION,9.717437456273767e-05,7.802407512880194e-05
24,"San Juan Mayor And FEMA Official Debate Hurricane Response ""And all I did last week, or even this week, was ask for help. It has to happen in a sustained manner,"" Carmen Yulín Cruz said. Jason Cherkis",POLITICS,9.69131271030006e-05,0.00010061336958622213
409,"Charles Koch Blasts Subsidies & Tax Credits, But His Firm Has Taken $195 Million Worth of Them Billionaire Charles Koch told a gathering of conservative donors Saturday that politicians must end taxpayer-funded subsidies ",POLITICS,9.674887459053201e-05,8.51542487600998e-05
19,"Eerie Sci-Fi Short Explores Quest To Feel 'Connected' With A Surprising Star Former ""Baywatch"" actress Pamela Anderson is intense. Antonia Blumberg",RELIGION,9.629921340274352e-05,0.00011912396866020636
597,WATCH: Scientist Puts ‘Deflategate' Under The Microscope  ,SCIENCE,9.617087803758255e-05,0.00015637958576952826
96,"Tim Kaine Reaches Out To Mormons With Stories Of His Own Mission Work With a third-party candidate rising in the ranks in Utah, Tim Kaine appeals directly to Mormons in a new op-ed. Carol Kuruvilla",RELIGION,9.594448207940588e-05,0.00014821618586480234
290,Obama Takes Stand Against Populist Candidate In French Election His support of centrist Emmanuel Macron is his first endorsement since leaving office. Willa Frej,POLITICS,9.530399241784357e-05,8.244165759307975e-05
895,GOP Tax Plan Estimated To Add $1.7 Trillion To National Debt The Republican plan sharply reduces individual and corporate tax rates. Matt Fuller and Arthur Delaney,POLITICS,9.459997317870865e-05,0.00019535922922875315
16,"Nancy Pelosi Says Republicans Are 'Stonewalling' Investigation Into Trump's Russia Ties “The public is owed the truth."" Igor Bobic",POLITICS,9.413058124437551e-05,0.00018625353760159946
744,"Science And Technology Combine In Search For Underwater Resting Place Of WWII MIAs ""Families of MIAs never quit -- they never stop missing the person who's been taken out of their lives,"" says BentProp Project founder Patrick Scannon. Lee Speigel",SCIENCE,9.371425585042024e-05,7.935960999150282e-05
474,Ruth Bader Ginsburg Returns To Work At The Supreme Court The Supreme Court associate justice had been working from home after receiving treatment for cancer. Marina Fang,POLITICS,9.335696631483305e-05,0.00010312736129192146
902,Hillsong Church Founder Defends Handling Of Father's Sex Abuse Case  ,RELIGION,9.333640170447752e-05,7.49706292226815e-05
812,"New Orleans Prosecutor Used Fake Subpoena To Pressure Teenage Molestation Victim, Lawyer Says The documents had no legal authority. They were a ruse, essentially, to coax reluctant witnesses to talk to prosecutors. The Lens, ContributorAn investigative newsroom focused on New Orleans and the Gulf ...",POLITICS,9.331667335106376e-05,6.024149928207656e-05
473,"Supreme Court Rules Trump Wrongly Ended DACA, Leaves Program In Place Nearly 650,000 people are currently protected from deportation under the Deferred Action for Childhood Arrivals program. Elise Foley",POLITICS,9.214386122450632e-05,0.00012586551011040115
