index,text,label,beta_shapley,loo
730,"Space Aliens Are Already Here Until astronomers detect signs of life on Earth-like plants around Sun-like stars, or until SETI searches record an old TV show broadcast by a civilization circling another star, we will have to be satisfied with these tiny, fluffy space aliens. Robert Sanders, ContributorScience writer, UC Berkeley",SCIENCE,0.0002224388799438287,0.0003931510430026375
616,"What NASA Is For: Straight From the Panda's Mouth Despite all the agency has done, despite all it has to offer, so long as human spaceflight is at the core of NASA's existence, it will never evolve beyond a faint echo of its prior self. Charles Seife, Contributor
Author and Professor of Journalism at NYU",SCIENCE,0.00022125733935631802,0.00021823659679243157
982,"The Retreat From Universalism: How Identity Politics and Old Time Religion Corrode Human Rights Progress Amid the ashes of World War II, with the stench of industrial-scale genocide in their nostrils, the nations of the world pledged to do better. They signed onto the Universal Declaration of Human Rights. Clay Farris Naff, ContributorScience and Religion Correspondent for the Humanist Magazine",RELIGION,0.00022085262190828548,0.00020788536861293672
92,"Why The Democratic Party's Move Against Bernie Sanders Could Backfire He apologized to his supporters and to Clinton, but the party might be sorry later. Samantha Lachman and Ryan Grim",POLITICS,0.00021984349729798253,0.00017694289174019495
726,Thousands Of Muslims Crowded Into The Streets Of German Cities This Friday  Carol Kuruvilla,RELIGION,0.00021929737394730115,0.00021576841891812748
998,Muslim Prisoners Say They Are Forced To Compromise Beliefs In Miami-Dade Prisons Muslim inmates in facilities within the Miami-Dade County Corrections and Rehabilitation Department say they've been forced Jared Greenhouse,RELIGION,0.00021910289789512955,0.0001796209166933238
272,"How The Catholic Church In America Is Doing On The Eve Of Pope Francis's Visit There's good news, and there's bad news. Rachel Zoll, AP",RELIGION,0.00021901196579377307,0.0002136274807247318
590,"How Quack Doctors And Powerful GOP Operatives Spread Misinformation To Millions A group calling itself “America’s Frontline Doctors” spread false information about COVID-19 with the help of Facebook, right-wing media and President Trump. Nick Robins-Early, Hayley Miller, and Jesselyn Cook",POLITICS,0.00021892919961317712,0.00021737634514917836
250,Milky Way's Vast Galactic Plane Shimmers In Hypnotic New Video The Herschel Space Observatory offers an unprecedented look at our galactic home. David Freeman,SCIENCE,0.00021656031683226602,0.00022077897299244142
441,"Ebola Outbreak Highlights Struggle for Science in Africa and Inequalities in Global Health Research In part, the lack of research in ""non-profitable"" infectious diseases occurring in underprivileged countries has left threats like Ebola largely unaddressed. In addition, inequalities within the system of international scientific collaboration have hindered African researchers from leading the way against diseases ravaging their continent. Tamer Fouad, MD, ContributorOncologist at the National Cancer Institute in Cairo.",SCIENCE,0.00021604555285274565,0.00016464899422374835
784,"August 9: A Day Of Repentence August 9th is a good time to remember that the United States has an addiction, and an affliction, of violence. Shane Claiborne, ContributorAuthor and Activist",RELIGION,0.0002109386430562375,0.00017336185969618612
35,"Donald Trump Met Reporters' Kids, And It Was More Trick Than Treat “Well, you have no weight problems. That’s the good news, right?” the president told children. Mollie Reilly",POLITICS,0.00020972024893754838,0.0002673412553559906
913,"Astronaut Builds LEGO Space Station Inside Real One The LEGO station's time fully assembled was short lived however. Due to the flammability hazards, the toy bricks could only ",SCIENCE,0.00020929367199540303,0.0002461582423984865
325,"Charlottesville: We are Human Beings First When I heard the news of the deadly violence in Charlottesville, Virginia, this past weekend, shock doesn't begin to communicate Michael Jinkins, ContributorMichael Jinkins is the President of Louisville Presbyterian Th...",POLITICS,0.00020908411656916196,0.00015867750259479507
246,Pope Francis Outlines Strict New Measures For Bishops Who Covered Up Abuse The pontiff has pledged zero tolerance for those who abuse children. ,RELIGION,0.0002065638237650374,0.00015991678536964038
77,"Rhode Island Latest State Poised To End Veterans' Homelessness ""It's hard for a person who is homeless to have dignity."" MICHELLE R. SMITH, AP",POLITICS,0.00020650492786691315,0.00012079076340798522
437,11 Things Hillary Clinton Must Do To Beat Donald Trump Defeating the demagogic billionaire won’t be as easy. Here’s the Clinton strategic checklist for the campaign's final months. Howard Fineman,POLITICS,0.00020599402274529006,0.0003080082494666403
894,Extreme Measures Americans Are Already Taking Before Pope Visit Ever slept in a zoo? Antonia Blumberg,RELIGION,0.00020543443853519795,0.00021734403971485072
904,"Earth's Core & Carbon: Planetary Center Holds Largest Store Of Common Element, Computer Simulation Suggests Even though the bulk of the core is iron, scientists have surmised it must contain a small amount of lighter elements such ",SCIENCE,0.00020539092418655238,0.00026285739129905394
571,"Pence Cancels Campaign Events In Florida, Arizona As States' COVID-19 Cases Soar The vice president dropped the appearances a day after boasting that the U.S. is ""flattening the curve."" Mary Papenfuss",POLITICS,0.00020404355782655106,0.0001662542242466536
702,"Sleep Study Looks At Link Between Shut-Eye, Exam Scores  Jacqueline Howard",SCIENCE,0.00020376246685608056,0.00022043364275159405
683,"Trump’s '72%' Number From Banned Nations Misstates What’s Going On The refugees from the seven nations had long been in the pipeline, and almost none entered in the week after he signed his order. S.V. Date",POLITICS,0.00020339993461530826,0.00012450622595938654
347,"Republicans Beg Supreme Court To Let Them Keep Using An Unconstitutional Map “There is no need to hurry"" to redraw those congressional districts, they said. Sam Levine",POLITICS,0.00020276139190593374,0.0002604349268917616
396,"Bill Nye Is 'Open-Minded But Skeptical' About Elon Musk's Bold New Vision For Mars Pros: Mars is exotic, romantic. Cons: It's cold, barren and can't even breathe. David Freeman",SCIENCE,0.00020194005245743502,0.00018885565926862746
411,"ICE Violates First Amendment Rights Of 60 Faith Leaders And Attorneys To commemorate World Refugee Day (Tuesday, June 20th), Community Initiatives for Visiting Immigrants in Confinement (CIVIC Christina Fialho, ContributorCo-Founder/Executive Director, Freedom for Immigrants (formerl...",RELIGION,0.00020171023710319517,0.0001900667095908748
971,How The Science Of Wasabi Could Pave The Way For New Pain Meds  Jacqueline Howard,SCIENCE,0.00020161738245816688,0.00014479147196166942
119,"Pope Francis Condemns 'Plague Of Terrorism' In New Year's Address “The year will be good in the measure that each one of us, with the help of God, seeks to do good day after day,” he told the crowd on a cold morning. Philip Pullella, Reuters",RELIGION,0.00020110857740603528,0.00021763675280439543
221,"Sikh Holiday, Christian Campus It's the time of renewal in the northern hemisphere. So how does a Sikh Religion professor who teaches at a Lutheran university celebrate Vaisakhi? Well, here's how the day of April 14, 2015 shook out. Rahuldeep Singh Gill, Ph.D., ContributorEducator, Author, Speaker",RELIGION,0.00020070017702645117,0.0002558211583594261
969,"Marco Rubio Slams Ted Cruz As 'Isolationist' Rubio said that while the Texas senator ""talks tough"" on national security, his actions tell a different story. Kelly Chen",POLITICS,0.00019978816602433299,0.00014926650241009476
479,"Pope Francis Depressed, weary, or frightened by stories of USIS and ISIS and other horrors, plus by debates over ""religious extremism"" and the role of Islam, we focus instead on the not-unimportant figure of Pope Francis, who makes news and inspires reflection. Martin Marty, ContributorHistorian of religion in the U.S., author of over 60 books, sp...",RELIGION,0.00019919666562735126,0.000265610252987436
413,"How Should The Media Refer To Donald Trump When He Defames The Central Park Five? A shadow editing assist for CNN, which is confused. Jason Linkins",POLITICS,0.00019849430044831948,0.0002656832283913779
224,"With Sanctions And Condemnation, U.S. Hints At Shift On Russia The new sanctions are the most significant the U.S. has taken against Russia since Trump took office. Arshad Mohammed and John Walcott, Reuters",POLITICS,0.00019776459879563519,0.00020994681527342074
985,"British Astronaut Is Sorry For Dialing Wrong Number From Space Smooth move, astronaut. ",SCIENCE,0.00019741233181288947,0.0001723011345704517
862,Ohio Girl's Abortion Doctor Once Targeted In Vicious Kidnapping Threat: Report Dr. Caitlin Bernard is also currently listed on the website of a militant anti-abortion group with ties to Supreme Court Justice Amy Coney Barrett. Mary Papenfuss,POLITICS,0.00019704416495938082,0.00015287766186000695
237,"Repent And Believe In The Gospel! Over 300 Christian Theologians Challenge The Corruption Of U.S. Christianity The Boston Declaration, condemning the abuse of the Christian faith by many conservatives today, was just written, signed Susan Thistlethwaite, ContributorI am a Professor of Theology and President Emerita of Chicago ...",RELIGION,0.00019693281717639264,0.00016082672729278435
956,"British Man Pleads Guilty After Grabbing Officer's Gun At Trump Rally Sandford's intent with the gun grab was not revealed in the plea deal. Curtis Skinner, Reuters",POLITICS,0.00019445787081354197,0.00012358816662527694
543,"Daily Meditation: Sacred Service We all need help maintaining our personal spiritual practice. We hope that these Daily Meditations, prayers and mindful awareness Antonia Blumberg",RELIGION,0.00019287689888006413,0.0001972592801740003
61,Are President Trump's Supporters Embarrassed To Tell Pollsters They Like Him? A new study tests the differences between online and phone surveys -- and finds little evidence of an effect. Ariel Edwards-Levy and Grace Sparks,POLITICS,0.0001924103858740642,0.00012811088262520975
634,"Remembering Babylon: New Exhibit Explores Roots of Jewish Life in Iraq The museum, based in Jerusalem, has amassed a collection of more than 100 cuneiform tablets, original documents from the Judean community, which are now on display to the public for the first time. Anav Silverman, ContributorInternational Correspondent in Jerusalem",RELIGION,0.00019216907882387113,0.00014609949333066474
700,"Some Fish Can Recognize Human Faces, Scientists Find Don’t underestimate your pet fish. Bahar Gholipour",SCIENCE,0.00019161134129740189,0.0001574055930089191
532,Daily Meditation: Reflection  Antonia Blumberg,RELIGION,0.00019101077276196033,0.00015970301492340688
485,"Lies, Damned Lies, and Bill Maher's Statistics What Bill Maher, Sam Harris and many others like them fail to realize is that religion as it is practiced is a product of a wide array of factors, the official texts being only one of them. People of any faith are more shaped by the norms of their cultural context, interpreting their religious texts to comport with those norms rather than the other way around. Timothy E. Kaldas, ContributorWriter, commentator and professor of politics based at Nile Un...",RELIGION,0.00019093549421165222,0.00019109047189402872
274,"Sacred Earth: Pope Francis and Bonna Devora Haberman The Jewish world lost one of our greatest voices for feminism and for a just Zionism this week, Rabbi Bonna Devora Haberman​. She was a founder of Women of the Wall, an activist and scholar, and co-director of YTheater, a Israeli Jewish and Palestinian theater company in Jerusalem. Rabbi David Seidenberg, ContributorCreator, NeoHasid.org; author, Kabbalah and Ecology:God's Imag...",RELIGION,0.00018947412271310904,0.00015512055783872825
262,"British Pastors, Politicians Want To Stop U.S. Evangelist From Preaching In Their Town Franklin Graham is facing vocal opposition to his U.K. visit for his bigoted rhetoric. Carol Kuruvilla",RELIGION,0.00018735754794001167,0.0002135679181107797
742,"Melania Trump Offers More Details On Her Immigration History, But Still No Proof Her attorney says media reports about when and how she came to work in the U.S. are wrong. Elise Foley",POLITICS,0.00018687775381517253,0.00015583102288374562
933,"Daily Meditation: How To Say Sorry We all need help maintaining our personal spiritual practice. We hope that these Daily Meditations, prayers and mindful awareness Antonia Blumberg",RELIGION,0.00018668684493748557,0.0001529290969657371
68,"Why Is The Southern Baptist Convention Cutting Hundreds Of Jobs? As many as 800 employees from the overseas missions agency will soon be unemployed. Adelle M. Banks, Religion News Service",RELIGION,0.0001859818886012359,0.00013820707137468524
568,"People Tell Their Tragic Stories To Try To Slow Trump's Rule-Killing Drive Meanwhile, Congress is considering a bill that would make it harder to write regulations. Kaeli Subberwal",POLITICS,0.00018395730210415425,0.0001873886896071042
992,'Better Late Than Never': Account Reposting Trump Tweets Verbatim Reacts To Twitter Ban The @SuspendThePres account reposted Trump's words for months to prove that an average citizen would be banned for such rhetoric. Jeremy Blum,POLITICS,0.0001828433224929217,0.0002017784313850246
638,"Chuck Grassley Blocks Judicial Nominees, Then Says GOP Is Doing A Great Job Confirming Them ""Put that in your pipe and smoke it."" Jennifer Bendery",POLITICS,0.0001824619550914349,0.00013128657960992385
194,Identical Twins' Genes Research Suggests Siblings Are Genetically Different SAN FRANCISCO – Identical twins may not be so identical after all. Even though identical twins supposedly share all of their ,SCIENCE,0.00018197127261037723,0.00015066213378367443
831,That Drone Skirmish With China? It Was Over Before Donald Trump’s First Mean Tweet. The president-elect would have known this if he’d taken his presidential briefing that morning before tweeting. S.V. Date,POLITICS,0.00018083106673382116,0.00018872087910848379
716,Conservative Senate Democrat Who Backs Trump’s Agenda Defeats Progressive Challenger Sen. Joe Manchin of West Virginia has voted with Trump 61 percent of the time. Alexander C. Kaufman,POLITICS,0.0001796237859115349,0.00021486269616532994
472,Amazing Image Shows Pluto's Frozen Canyons Take a closer look at the planet's impressive landscape. Steven Hoffer,SCIENCE,0.00017922828516165687,0.0001430569203406673
370,"What The Pope And Thousands of Pagans Have In Common The causes of our environmental crisis are more complex than any single religion. We can neither vilify Christianity, nor idealize ancient pagan religions. John Halstead, ContributorActivist, Blogger,  Editor of ""Godless Paganism""",RELIGION,0.0001788392632075797,0.00012633498620440164
631,12 Awe-Inspiring Poets To Read In Your Lifetime Medicine for the soul. Antonia Blumberg,RELIGION,0.00017877128285682497,0.00017400113867727107
302,"Brain & Obesity: Neural Implant Could Curb Overeating, Mouse Study Suggests Deep brain stimulation is already used as a way to help reduce tremors in patients with Parkinson's disease, and scientists ",SCIENCE,0.00017863232859541503,0.0001965459685884241
544,"Paul LePage May Skip State Of The State Address Amid Talk Of Impeachment ""I'll send them a letter and we'll call it a day."" Amanda Terkel",POLITICS,0.00017564784102976785,0.00016841334295203403
884,"Reb Zalman's Unique Funeral His leaving was as unconventional as his teaching and his life. Rabbi Zalman Schachter-Shalomi wanted no casket, no plain pine box. For his funeral, held on the Fourth of July, he wanted to be clothed in his white kittel. Sara Davidson, ContributorAuthor of ""The December Project,"" ""Loose Change"" and ""Joan: Fo...",RELIGION,0.0001753459921171937,0.00014785747025469753
578,Bill Clinton: I Don't Think I'm Good At Campaigning Anymore 'Because I'm Not Mad At Anybody'  Paige Lavender,POLITICS,0.0001751900752460986,0.0001689001566234083
17,REVEALED: Why Feathers First Evolved  Jacqueline Howard,SCIENCE,0.00017517755904408681,0.00015490392246975127
522,"Spacecraft Lifts Off In Search For Life On Mars The European-Russian mission is the latest to seek out Martian life. Maria Sheahan, Reuters",SCIENCE,0.00017507472271099993,0.00021113155366148106
707,Arts Funding Gets A Boost From Congress After Trump Suggested Slashing It The budget deal is a rebuke to the White House proposal for draconian cuts. Marina Fang,POLITICS,0.00017496300631304968,0.00025424535821438887
965,LOOK: 1 Million Monks Can Fit In This Buddhist Temple  Antonia Blumberg,RELIGION,0.0001749319597996974,0.0001572262476490227
142,"Christians And Jews Team Up To Help Muslims After Texas Mosque Fire “Jewish community members walked into my home and gave me a key to the synagogue."" Ed Mazza",RELIGION,0.00017458476381856992,0.000141014029380937
555,"Why Do Kettles Whistle? Science Has An Answer The high-pitched note emitted by hot kettles has puzzled scientists for more than a century, but thanks to two steamed-up Ryan Grenoble",SCIENCE,0.0001738932992567191,0.00018127074066742743
877,"Religious Profiles: Another Amazing American Muslim Woman (PHOTOS) Hanif established Muslimat An-Nisaa in 1987 to help Muslim women and children access health, education and well-being services that were otherwise unattainable. Soon, she began providing shelter services as well, to those who needed it. Engy Abdelkader, Contributor",RELIGION,0.00017368934718342603,0.00014941709028359895
189,How One Member Of Congress Gets Away From It All  Matt Sledge,POLITICS,0.0001730230161066821,0.00020070965384233475
233,"Stop Trying To Repeal Obamacare, Former GOP Official Tells His Party You can't do it, Tommy Thompson said, and you shouldn't try. Jonathan Cohn",POLITICS,0.0001724755442264985,0.00015539066335934493
656,"Feuding Chelsea Clinton And Kellyanne Conway Go At It On Twitter Trump's counselor snaps back at the former first daughter over her dig about the ""Bowling Green massacre."" Mary Papenfuss",POLITICS,0.0001719435287497085,0.00013072057650975744
586,"How ESPN Became A Political Punching Bag In The Trump Era Conservatives rage that ESPN should have suspended or fired Hill; its statement (“We have addressed this with Jemele and Daniel Roberts, Yahoo! Finance",POLITICS,0.00017122405690760074,0.00017056799892056773
292,"Scientists Scan 100,000 Galaxies But Find No Evidence Of Alien Life  Macrina Cooper-White",SCIENCE,0.00017096123656982224,0.0001564377093090652
675,"Two Sex Educators On Confronting Taboo Topics In The Classroom Hundreds of miles apart, educators Emily Feher and Melanie Lucash aren't shying away from sticky subjects. Antonia Blumberg",RELIGION,0.00017064791883224307,0.00013607940397553087
719,"'Access Hollywood' Shoots Down Trump: 'The Tape Is Very Real' ""He said every one of those words."" Mary Papenfuss",POLITICS,0.00017058383054131872,0.0001391864117514796
923,'Moby Dick' May Be More Than Just A Whale Of A Tale New research suggests sperm whales can use their huge heads as battering rams against ships and each other. Lee Speigel,SCIENCE,0.00017021328948261662,0.00017724656869777533
720,1 in 4 Americans Believe God Will Decide Super Bowl  Antonia Blumberg,RELIGION,0.00016985844580033423,0.00019375979880020822
942,"Trump Asked Comey When Feds Would Say He Wasn't Under Investigation The former FBI director saw it as his job to protect the bureau from ""interferences from a group of people he did not regard as honorable."" Nick Visser",POLITICS,0.00016967283164104327,0.00010977523507826881
995,American And Israeli Jews Are Strongly Connected But Sharply Divided The Pew Research Center takes a look at Jewish life in Israel and the United States. Carol Kuruvilla,RELIGION,0.00016931381536281897,0.00027965926637429916
114,"Toward True Religious Freedom The reason I am against the Religious Freedom Restoration Act is not because I am a lefty liberal, but because I am a proud American Christian. This legislation, though guised in the cloak of religious liberty, is the first string to be pulled out of our basic civil rights. This state is beginning the slippery slope of legalized discrimination. Justin Thornburgh, ContributorHusband, daddy, and pastor at Emerson Ave. Baptist on the east...",RELIGION,0.0001679302504107336,0.00013801037878735656
1,"White House Talks Tough On Iran, But Suggests Nuke Deal Is OK After All Trump’s staff warns Iran that its recent missile test is a problem -- but notes that the country is still in compliance with its high-profile nuclear agreement. S.V. Date",POLITICS,0.00016730310420825357,0.00014041991714375257
251,Trail To The Chief: The Darkest Of The 2016 Dark Horses Edition  Lauren Weber and Jason Linkins,POLITICS,0.0001665422706105734,0.0001295295401559926
524,"Ben Carson: Donald Trump Has 'Major Defects' ""Are there better people? Probably."" Shahien Nasiripour",POLITICS,0.00016651931970857925,0.00011657134023024263
227,"WTF Is Wrong With You, Trump? Seriously... what the f*** is wrong with you? Nazis? Really? Nazis? This was supposed to be a textbook slam dunk. A no-brainer Andy Ostroy, ContributorPolitical and Pop Culture Analyst",POLITICS,0.00016507278802540255,0.00015300457232969578
294,Pennsylvania's Congressional Delegation Will No Longer Be All Men It looks like at least one woman will be heading to Washington from the state. Amanda Terkel,POLITICS,0.0001644345553060093,0.00019032503429339265
59,"Chuck Schumer Says Senate Democrats Are Open To Single-Payer Health Care The Democratic party was ""too cautious"" in the past, he said. Mollie Reilly",POLITICS,0.00016418133428183643,0.00017370819840789586
295,Pope Francis Leads Thousands In Prayer for Kidnapped Victims Of ISIS  ,RELIGION,0.00016399506606966564,0.00019087326050293285
22,"Hillary Clinton Gives U.F.O. Buffs Hope She Will Open The X-Files When Jimmy Kimmel asked Hillary Clinton in a late-night TV interview about U.F.O.s, she quickly corrected his terminology ",POLITICS,0.0001637214465951039,0.00021157791659276448
646,"Mercer Family Sides With Trump, Distances Itself From Steve Bannon The family is reportedly considering dropping Bannon from his post overseeing Breitbart. Ryan Grenoble",POLITICS,0.0001630288382037514,0.00014144416555472716
443,"Loneliness Is Bad For You, And This Study May Help Explain Why Feeling lonely may trigger changes in our cells that could make us more susceptible to illness. Jacqueline Howard",SCIENCE,0.00016279597816768387,0.00016585642142286083
793,SC State Rep: I'll Introduce Legislation To Remove Confederate Flag  Braden Goyette,POLITICS,0.00016185011405817523,0.00018519017189833065
761,"Avi Weiss, The Rabble-Rouser Rabbi, Takes Stock After An Activist Career  ",RELIGION,0.00016149089418927498,0.00012011608495754444
14,"Trump Expels 60 Russians, Closes Russian Consulate In Seattle After UK Chemical Attack The order reflects concerns that Russian intelligence activities have been increasingly aggressive. ",POLITICS,0.0001600233570605371,0.00011616167450134718
438,"If the Pope Is Really Serious About Fair Pay Then He Should Make Altar Girls Mandatory If Pope Francis really wants women to be paid fairly, there is something he can do today that would alter his culture in a disruptive and transformational way: he should make the appointment of altar girls a priority and begin the process of allowing women to be priests and cardinals. Soraya Chemaly, ContributorFeminist, writer, and satirist (not always in that order)",RELIGION,0.00015996328412620385,0.0001153143831305048
641,Why Some Synagogues Are Using Mission Trips To 'Heal The World'  ,RELIGION,0.00015821851115128195,0.00012400083519348293
289,This Swimsuit Cleans The Ocean As You Swim California scientists have created an absorbent nanosponge material that can be sewn into swimwear and wet suits to soak ,SCIENCE,0.00015780313209972708,0.00025792067692509413
888,"Lake Whillans Submarine Played Key Role In Search For Subglacial Life (VIDEO) By: Becky Oskin, OurAmazingPlanet Staff Writer Published: 03/01/2013 02:53 PM EST on LiveScience Antarctic Album: Drilling ",SCIENCE,0.0001574812531806472,0.00012763646011859642
685,"Alien Life Unlikely To Survive Around Dying Stars In Shifting Habitable Zones, Study Suggests Life is unlikely to survive on exoplanets that orbit cooling stars such as white dwarfs, a new study suggests. ""So, even ",SCIENCE,0.00015734625510058713,0.00012591670579431558
630,"A Living Mars: PHOTOS Show How Red Planet Might Look With Water ""This wasn’t intended as an exhaustive scientific scenario as I’m sure (and expect) some of my assumptions will prove incorrect Meredith Bennett-Smith",SCIENCE,0.00015716569385843283,0.0001900924374236279
397,"Bernie Sanders Supporters Unleash Sexist, Nasty Attacks On Nevada's Dem Chair Just listen to the voicemails Roberta Lange has received. Sam Stein",POLITICS,0.00015679497149457522,0.00015128189069546494
330,Daily Meditation: Free Hugs  Antonia Blumberg,RELIGION,0.00015677549092673189,0.00014931610323798417
373,Donald Trump Blasts China's 'Unpresidented' Seizure Of U.S. Navy Drone All while remaining unfazed by suspected Russian cyberattacks. Chris D'Angelo,POLITICS,0.0001562683725173425,0.000147969046108809
